{
  "$schema": "https://json-schema.org/draft/2020-12/schema",
  "type": "object",
  "properties": {
    "schema_version": {
      "const": "3.0.0"
    },
    "record_type": {
      "const": "agent_run"
    },
    "run_id": {
      "type": "string",
      "minLength": 1
    },
    "scope": {
      "type": "object",
      "properties": {
        "subject": {
          "type": "object",
          "properties": {
            "type": {
              "enum": [
                "student",
                "class"
              ]
            },
            "id": {
              "type": "string",
              "minLength": 1
            }
          },
          "required": [
            "type",
            "id"
          ],
          "additionalProperties": false
        },
        "scenario_id": {
          "type": "string",
          "minLength": 1
        }
      },
      "required": [
        "subject",
        "scenario_id"
      ],
      "additionalProperties": false
    },
    "audience": {
      "enum": [
        "teacher",
        "student"
      ]
    },
    "target_node_id": {
      "type": [
        "string",
        "null"
      ]
    },
    "snapshot_ref": {
      "type": "object",
      "properties": {
        "snapshot_id": {
          "type": "string",
          "minLength": 1
        },
        "revision": {
          "type": "integer",
          "minimum": 1
        }
      },
      "required": [
        "snapshot_id",
        "revision"
      ],
      "additionalProperties": false
    },
    "trigger": {
      "enum": [
        "view",
        "evaluation_changed",
        "question",
        "retry"
      ]
    },
    "state": {
      "enum": [
        "queued",
        "running",
        "succeeded",
        "failed",
        "superseded"
      ]
    },
    "mode": {
      "enum": [
        "diagnosis",
        "question"
      ]
    },
    "artifact_id": {
      "type": [
        "string",
        "null"
      ]
    },
    "turn_id": {
      "type": [
        "string",
        "null"
      ]
    },
    "error": {
      "type": [
        "string",
        "null"
      ]
    },
    "tool_trace": {
      "type": "array",
      "items": {
        "type": "object",
        "properties": {
          "tool": {
            "type": "string",
            "minLength": 1
          },
          "arguments": {
            "type": "object"
          },
          "node_count": {
            "type": "integer",
            "minimum": 0
          }
        },
        "required": [
          "tool",
          "arguments",
          "node_count"
        ],
        "additionalProperties": false
      }
    },
    "usage": {
      "type": "object",
      "properties": {
        "model_calls": {
          "type": "integer",
          "minimum": 0
        },
        "input_tokens": {
          "type": "integer",
          "minimum": 0
        },
        "output_tokens": {
          "type": "integer",
          "minimum": 0
        }
      },
      "required": [
        "model_calls",
        "input_tokens",
        "output_tokens"
      ],
      "additionalProperties": false
    },
    "created_at": {
      "type": "string",
      "minLength": 1
    },
    "updated_at": {
      "type": "string",
      "minLength": 1
    }
  },
  "required": [
    "schema_version",
    "record_type",
    "run_id",
    "scope",
    "audience",
    "target_node_id",
    "snapshot_ref",
    "trigger",
    "state",
    "mode",
    "artifact_id",
    "turn_id",
    "error",
    "tool_trace",
    "usage",
    "created_at",
    "updated_at"
  ],
  "additionalProperties": false
}
